comment,toxic
 legends pertaining to mucalinda i have heard and read from several sources a story which elaborates on the mucalinda legend according to this story  the buddha was pleased with his protector and blessed him by placing a hand on his hood as a sign of the buddha s blessing  cobras bear his fingerprints on their hoods indian or spectacled cobras  naja naja  of course have two ocelli or eyespot markings on the back of their hood  these are thought to serve as eyes in the back of the head  with the adaptive function of deterring predators that might try to attack the standing cobra from behind this story may be told in thailand also  although there is a slight inconsistency in that thai cobras  naja kaouthia  have only one spot  i have also heard a variant in which the buddha was protected by the serpent not from rain storms but from the blazing indian sun unfortunately  i cannot find a decent source for either of these elements in the mucalinda story and do not know where they originated ,0
i thought he was jasper cullen  when was he ever referred to as jasper hale ,0
akc suspensions  the morning call feb ,0
kristof the problem here is a lag from the old ukrainian orthography that has since changed  a similar case existed in belarus  but much more amplified  when the changes of s and subsequent orthographic reforms were very noticeable it affected the way whole cities were spelled  example minsk and mensk  in fact that is the reason why there are two versions of belarusian edition wikipedia  one uses the old and the other the official adopted version  in ukrainian language a similar happened but to lesser extent  and only some cities were affected e g  rivne became rovno  luhanske became luhansk  konotip became konotop and so on  with our city as far as i am aware it too became during the s some of those changes were reversed  and it really falls to because in ukrainian there are sufficient differences between dialects  in fact if you compare western and central ukrainian the differences would be more vivid than that of british and american english  so for some cases like rivne  it was much up to the locals  because volhynian dialect pronounces the city like its spelled  whilst somewhere in poltava they will say it as rovno  it seems that with mukhachevo it is a case that the version used by locals is not entirely adopted nationwide  but then again there are some silly people in the government who use spellings such as sevatopil but that is outright stupid  because even in classic orthography that version would never be used  the  pil originates from the connotation of field like ternopil  the  pol comes from the greek root for city  like sevastopol  all the more reasons why we should stick to mukachevo and help to leave the archaic spelling where it belongs in history ,0
 how can u judge a sport personality just on the basis of a headbutt or w hate ver he z the hero player  of the year despite of getting the red card he bravely accepted the decision calmly he retained hiz patience during all the past matches there wz a remarkable improvement in game nobody knoz what happened b w zizou and mrazi so by just watching the reaction of zizou how can u comment on the public voting and achievements  by chance if he wz being voted highest for the golden ball then what wz other comment u would have prepared try see the sides of coin  may be u would feel guilty on ur decision come on turn the coin ,0
i didn t create the page i just moved it to capitalize it ,0
thanks thanks for fixing the move ,0
 please remove that bs about righty lefty and no credible source about forbidden ring of course you can use both hands to drink  also all three man in the video appear to wear weeding ring any source  from imam  about muslim not allowed to wear gold rings even when they are wedding rings  ,0
for your bad behaviour,0
a lot depends on how the various companies have set themselves up financially  companies that have committed themselves to buy feedstock or wafers at high prices for the next several years are going to have bigger problems than those who have some flexibility in their contracts  for example  it will also depend on how their lines are set up on how reliant they are on manual labor  on cell production lines at large manufacturers i think you will find little reliance on manual labor in either country but regardless  a tariff would push pv prices up just as they re finally beginning to come down  i don t that s a good idea  i also don t think it would have the desired effect  i don t have any figures on how much pv the us imports from china  but some of us pv exports go to china  furthermore  the us is still a net exporter of pv modules so for a tariff to have the desired effect i think it would have to be levied by some other government that is more significant to the chinese pv industry ,0
no thanks  i ll earn it ,0
she looks younger than she actually is,0
what adjective would you use to describe their elimination then ,0
 posted from maryland talk page with acknowledgement from thisisbossi  i m getting the sense of a double standard for maryland here  why is maryland the focus of this brigade when other state intros are equivalent  i ve avoided posting in these discussions because it seems you guys are reluctant to seeing the truth and now i have to write a book to get my point across  even still you will believe what you want to because of personal preference or you don t feel it belongs most of all i m sure you could care less about the state itself otherwise you wouldn t object  but you want an answer so here it is if you think the intro to the maryland page needs a rework then you have your work cut out for you because you re going to have to change just about every other state  case in point  this is the last paragraph from the commonwealth of virginia intro  virginia is known as the mother of presidents because it is the birthplace of eight u s  presidents  george washington  thomas jefferson  james madison  james monroe  william henry harrison  john tyler  zachary taylor  and woodrow wilson more than any other state  most of the united states  early presidents were from the state  virginia has also been known as the mother of states because portions of the original colony subsequently became kentucky  indiana  illinois  and west virginia as well as some portions of ohio  how is that anymore relevant than proclaiming maryland donated the land for washington  d c  doesn t talk about presidents from decades past and ceding portions of land belong in the history section according to you not convinced  here s part of the intro from the state of wisconsin  this should put your economic fears to rest wisconsin s rural economy was originally based farming  especially dairy mining  and lumbering  in the th century tourism became important  and many people living on former farms commuted to jobs elsewhere  large scale industrialization began in the late th century in the southeast of the state  with the city of milwaukee as its major center  in recent decades  service industries  especially medicine and education  have become dominant  wisconsin s landscape  largely shaped by the wisconsin glaciation of the last ice age  makes the state popular for both tourism and many forms of outdoor recreation in previous version they were proclaiming fur trade  but it s a sin to proclaim the life sciences which has become the foremost important industry in maryland right now didn t get the message  try the commonwealth of massachusetts during the th century  massachusetts  trans formed itself from a mainly agricultural economy to a manufacturing one  making use of its many rivers for power to operate factories for shoes  furniture  and clothing  its economy declined in the early twentieth century when industry moved south in search of cheaper labor  a revitalization came in the s when  nourished by the graduates of the area s many elite institutions of higher education  the boston suburbs  particularly those around route became home to dozens of high technology companies  massachusetts  colleges and universities  as well as its technology sectors  continue to thrive the state is also considered a haven for progressive  liberal thought and often sends political candidates to the national scene  however  the four most recent presidential aspirants  ted kennedy  michael dukakis  paul tsongas  and john kerry  were all unsuccessful massachusetts was the home state of us presidents john adams  john quincy adams  calvin coolidge  and john f  kennedy  and the birth state of george h  w  bush  as of massachusetts is the only state in the union to legalize marriage of  gay  and lesbian couples must i continue  it should be clear by now  said  my version was hardly all about geography  it had a sentence touching upon its civil war history as well as some information on its population and economy this is what you left posted in the intro maryland  ipa m l  nd nicknamed the old line state and the free state  is located along the east coast of the us  historically a border state  it exhibits characteristics of both the northern and southern regions of the united states  consequently  it can be considered both a mid atlantic state and a south atlantic state  maryland comprises a mountainous western panhandle  a fertile coastal plain  and a central region  chesapeake bay is largely within the confines of the state  the broad central region includes a stretch of the eastern megalopolis  an entirely metropolitan r,0
launch date no where in the article does it mention when stumble upon was founded  the home page says copyright i believe this information is relevant and should be added to the page  i  however  cannot find a more concrete date as to when the software went public ,0
thats my info not you guys if it is then i wouldnt have made so you cant steal anythign that i have for info get you own i will sue every oen of you for fraud and stealing,0
hibiscus leave s i have a very big hybiscus tree  when we moved in  it was riddled with bug s and disease  so i cut it right back and treated it  it is growing back well  how ever it now seem s that it has a different problem  it look s like the leave s have pimple s  white risen dot s and still hasn t flowered  can some one please help me n hough ,0
suggestion hello i noticed your edits to emf related articles  which were brought up on the adminstrators  noticeboard  i don t disagree with the core of your assertions  nor with the need to present prevailing scientific opinion as such and minority views as minority views  however  your approach is raising some hackles  i d suggest discussing your concerns further on the article talk pages and trying to reach some sort of consensus about how to better present the mainstream view of emf related health issues  tirades  however justified they may feel  are counterproductive in the long run  although it often doesn t feel like it  reasonableness will eventually win out here if you re able to cool off and explain your position calmly  making rapid fire edits to the pages in question while a controversy is unsettled on the talk page is not a good idea  if you re deeply concerned about the current version  you can tag it with pov or totallydisputed until the issue is resolved on the talk page this is not ideal  but preferable to an edit war  talk,0
i agree  the introduction is biased and low quality  the english is broken too ,0
check the map on the right  or here  or here ,0
question how can i nominate an article for deletion ,0
 so  are you going on record as being tolerant of lying here is lying a benefit to the project perhaps the old system of lying for the lord is actually something we should strive for i m doing it to stop wp from becoming another tract for the lds faithful  this isn t the  church of latter day wikipedians but what  do  you  think talk p s  your ally routerone lied  and is now trying  rather feebly  to explain the lie away  talk  ,0
acid no hitter this is a popular story  and well referenced  but there is some skepticism that probably should be in the article about this event bill christine  a beat reporter of the pirates disputes the story  though i wish i could find a better source than deadspin ,0
i ve noticed the scottish people article has now been updated  you need to now add this information about british descent to the welsh people article  the english people article  the irish people article  the northern irish people article  and the cornish people article  you have my full support to do these things ,0
please can you stop this viscous victimisation ,0
  fwiw the industry often calls itself quick service restaurants ,0
thank you very much for understanding and a good faith gesture  i respect people that do that  i look forward to working with you in the future  best of luck ,0
that play wasn t spectacular  it was just ok just like any other homerun robbing play the only reason people are hollering on that thing was because of the perfect game  otherwise it would be just another play the catch was not spectacular ,0
 may allah  swt  either give you punishment or hidiyaat for spreading falsehood and keeping other muslim editors from making the article neutral insh allah  preceding unsigned comment added by preceding unsigned comment added by your comment on your edit proves you are ignorant of islam  preceding unsigned comment added by ,1
personally i think the vietnamese flag is correct  being that cung le is from the country of vietnam  however in his sherdog fighter profile it states that his country is the usa the subject is still under debate  does anyone else have anything to say ,0
you re a twat and a jew have a nice day ,1
the people before this are faggot ,1
please tell me how there is conflict of interest ,0
okay  yeah that doesn t really say too much  but i guess it is worth note of on the actual batman film series article ,0
enginer scottie is an account intended to impersonate me  use the  tag for that  but i have good reason to believe that it is,0
 for you the citation barnstar for your initiative in creating the sources archive  n mi  ,0
removing talk page comments hi again aperisic  this is just to let you know that in general you can t remove a discussion from a talk page if it also includes comments by other editors  as in talk almost integer  it had only comments by you and me  and i don t mind in this particular case  so you can leave it as it is  thanks ,0
 lima esoglou  did you know the quote was bogus when you edited it on dec last year saying that cs lewis had already answered and refuted the pagan origins arguement ,0
a page you started  citysuper  supermarket has been reviewed  thanks for creating citysuper  supermarket palaceguard wikipedia editor  just reviewed your page  and wrote this note for you hi  this article  citysuper  supermarket does not have any issue  nice work  to reply  leave a comment on deepanshu s  talk page learn more about page curation ,0
i would be happy to make this edit  as i agree the current text is unacceptably biased  however  i d like to see a version with some proper citations in it first this should be relatively easy given the press and website coverage ,0
pederasty i think it is uncalled for to block the article for a month  no one is warring over it  and we may have to do some work on it in the near future ,0
 dan  what exactly are you still arguing  is the balance about right  or do you think that we need more negative stuff talk contribs ,0
hello  i have removed the speedy delete template from your user page  it was intended to go on the main space page  sorry ,0
 if any  wishes to discuss the issue in detail  please contact me for an explanation  with regard to shuttegod i am in militant disagreement that the previous text he mangled reduced in his arrogant edit was wordy or awkward it was a tight  concise very well written opening to the article explaining in essence what the anglosphere is  what he reduced it to with his edit with its bombastic egotistical patronising editing note was weakly written  mushy  vague illogical at points  sorry if that s a bit tuff  but it s the truth  the anglosphere is an increasingly important concept geo strategically it s important to get this source for the term right for those who search via google for an explanation of it  i am open to edits  but they need to augment improve the opening text  not reduce state things that are not true  such as eire being a part of the anglosphere any  with the slightest comprehension of the history of ireland since can see the fallacy of this view whomever holds it does not grasp even the basics of what the anglosphere actually is plantdrew yr edit of the arms programme that militarily links the anglosphere was useful interesting i left it at  st  even tho it didn t quite belong in the opening preamble of the article as it was a little too micro not macro enough for an opening principle description  the reason i edited it out in my scrapping of shuttegod s massacring of the text is that it seemed to be antagonizing him it was out of place a little in the opening  please place in in the body of the text lower down under a military links section by all means bardrick  ,0
indo greek map though i ve restored the correct map i think it still needs alterations the line around gujrat should be clamped to the land  the line shoud be somewhat thinner and as for patna  i think the eastern boundary would be just a bit to the east at the ganga as it makes sense for it would have easier to defend for the time they were there  they did leave of their own accord due to a coup  though this should be verified ,0
how i can read the books on wikepedia,0
reply i wouldn t post your phone number on wikipedia  wikipedia pages are mirrored on many other websites  and your number may become very public very quickly  by the way  how old are you talk contribs ,0
 please stop adding unreferenced controversial biographical content to  articles or any other wikipedia page  content of this nature could be regarded as defamatory and is in violation of wikipedia policy  if you continue  you will be  block  from editing wikipedia  cheers  ax  ,0
may utc  obviously  no one will be  block banned or otherwise disciplined because they ve refused to participate in mediation  i would encourage you to participate in it myself but ultimately you re right  it is a voluntary process and you don t have to do it if you don t want to  sarah ,0
you still  suck  what did you do  report me i don t care do it again get me  block i want to be  block i  hate  you get a life ,1
just improved the taxpayer march on washington article  i took out all those unofficial signs and gave you credit thanks for the mentoring i took the lesson you gave me and then applied it to another article but now people are upset  saying that those signs  even if unofficial  are important let s not let them win  i anticipate your immediate support  ,0
hey hey faggot are you dead yet  or are you watching your mom getting rape  by filthy pigs  which one is it  i m coming to rape your mom and shoot your entire family  you have week to live  you mother  fuck  er ,1
your post at wpus i just wanted to let you know that very few watch wpus anymore  its mostly a dead project  you might have better luck leaving a note at wp us congress ,0
i guess that is all about your age  you are too old and cannot update the data you already have in your brain  how can one explain so huge desire to offend people ,1
just saw your olive branch  hi  i only saw your olive branch near the end of may last posting session  i had to go so had no time to respond  i wanted to say that i appreciated it and if i had more time  i would have offered you an olive branch back since i was under time pressure  i decided to withdraw my comment about wikipedia policy versus thinking independently because i was concerned that my wording might have been getting too heated  i withdrew another comment  about overmedication  to avoid misunderstanding as it never had anything to do with you at all  or any other person posting on dr  daniel amen  related pages but i was concerned that it might be taken that way  thanks ,0
just so you don t think i m going behind your back  i ve posted a comment on flakeloaf s user page you may want to check out  ,0
political endorsements i was asked by another editor to review the section dealing with the obama endorsement i have removed the superfluous trailing paragraphs because they are not relevant to caroline kennedy  this is a biography  not an analysis of her endorsement including information about other endorsement  beyond her own as well as offering responses and commentary  is a violation of wp syn and wp undue  blaxthos t c  ,0
wait a sec  nufy in a very old version of darth malak s page  it said he was succeeded by the triad of traya  nihilus  and sion  then i realized this could be impossible  because traya was the master of both  because of this  she succeeded malak  and in turn sion and nihilus both succeeded their master  since i have not read up that much on thier histories  i asume they didn t murder each other  it seems sion was somehow convinced by exile to kill himself  but i don t know what happened to nihilus jun utc ,0
dalea compacta i ve added a taxobox to this article  however  see p of this report  pdf is it possible that the plant referred to by your source is really dalea cylindriceps  as d  compacta  sensu barneby  doesn t occur in new mexico ,0
i dare you try to blcok me the best of them all  i know where you live ha ha ha ,0
 you re quite a coward kutta  no just joking however  one thing s for sure that you re condescending  and you guys are a bunch of low live lobbyists  you think this is cool  spending your whole life in on inside wikipedia  i can easily provide sources proving i m right  but you guys aren t even worth it  nerds  i am telling jimmy whales  immediately calls out from basement jimmy  whales  dear  can you please get rid of the two kutte up here thanks a million  yahya al shiddazi preceding unsigned comment added by ,1
 article title i think this article would be more appropriately titled  list of axis leaders of world war ii  ,0
  you believe that the correctness of the image caption should be measured against what you believe is an accurate paraphrase rather than the actual language of the source whose meaning is being represented  so  who appointed you god ,0
 listas spicer  david,0
the secondary source is pocock i m afraid  paper book ,0
  the editor in question is strongly suspected to be wikipedia long term abuse cause of death vandal  a link like cbe is piped through a redirect because if you hover over that link  it shows the full title  and when you click on it  you get the redirected from commander of the most excellent order of the british empire message at the top of the page  it s also a wp notbroken situation one day  we might split out the five different levels into their own articles  the article must not be moved  since it covers seven awards member of the most excellent order of the british empire  mbe  officer of the most excellent order of the british empire  obe  commander of the most excellent order of the british empire  cbe  dame commander of the most excellent order of the british empire  dbe  knight commander of the most excellent order of the british empire  kbe  dame grand cross of the most excellent order of the british empire  gbe  knight grand cross of the most excellent order of the british empire  gbe  that is  five different levels  two having gender specific titles  as i mentioned before  a lot of people think that obe stands for order of the british empire it doesn t  since the o stands for officer ,0
 if they were a self appointed organisation how would that explain the fact that they are directly involved with designing the national flags of british territories ,0
 concerning the article hinayana buddhism from wikipedia as a note in thailand  where the national religion is theravada buddhism  the national museum  in its display concerning the history of the kingdom of thailand  specifically the sukkhothai and ayutthaya periods makes a very clear distinction between theravada and hinayana buddhism listing it as a seperate  religion  along with mahayana buddhism and christianity that was at times under the patronage of the king it would appear that the thai hierarchy of buddhism has no confusion concerning the use of this term  ,0
i believe  since the category was in a template when it was updated  it may take a few days for it to update  john reaves,0
it has the advantage that it will only upload images that have the correct licence ,0
