comment,toxic
 possible original research  i only skimmed through on these parts  but it seems to me that most of this needs to be cited either for verification  or simply for the sake of further reading french people often refer to metropolitan france as l hexagone  the hexagon because of the geometric shape of its territory unless it was a frenchman or frenchwoman who added that in  how can we know for certain that they really do  is this self made nickname for that region so internationally renowned that it s a surefire fact  unless one can respond in the affirmative to either question  it needs a citation there are various theories as to the origin of the name of the franks  one is that it is derived from the proto germanic word frankon which  trans lates as javelin or lance as the throwing axe of the franks was known as a francisca another proposed etymology is that in an ancient germanic language  frank means free as opposed to slave  this word still exists in french as franc  it is also used as the  trans lation of frank and to name the local money  until the use of the euro in the s however  rather than the ethnic name of the franks coming from the word frank  it is also probable that the word is derived from the ethnic name of the franks  the connection being that only the franks  as the conquering class  had the status of freemen  in german  france is still called frankreich  which literally means realm of the franks in order to distinguish from the frankish empire of charlemagne  modern france is called frankreich  while the frankish realm is called frankenreich now here we re talking about cite cite cite for crying out loud cite  some of this might not only be original research  but speculation  also  two wikipedia no nos riddled into one  it seems like you only walk one paragraph or two down the article and bam  the poor thing is literally kissed with original research  something has to be done  the original research label goes back till it s done  ,0
also i have worked with microarrays  we cannot do what you are suggesting yet ,0
welcome hello  schweboo  and welcome to wikipedia  thank you for your contributions  i hope you like the place and decide to stay  here are some pages that you might find helpful  the five pillars of wikipedia tutorial how to edit a page and how to develop articles how to create your first article  using the article wizard if you wish  manual of style i hope you enjoy editing here and being a wikipedian  please sign your messages on discussion pages using four tildes this will automatically insert your username and the date  if you need help  check out wikipedia questions  ask me on my talk page  or ask your question on this page and then place help me before the question  again  welcome ,0
 unprotect talk connie garner hallo  please unprotect talk connie garner you was the admin protecting it long time ago with the reason protected talk connie garner create sysop indefinite repeatedly recreated hist but it has an article now  and i want to add a wikiproject tag  thanks  i ve unprotected the page but i do note that the article needs cleaning for wp overcite issues  rather than putting sources behind one sentence  these should be interspersed throughout the article and or reduced to about sources  it also needs some cleaning for consistency  article subjects should be referred to by their last name throughout the article and in the article there are sentences that refer to garner by her last name and by connie  ,0
 fourth examination th december additional statements  the sum of a thousand pounds  or crowns  was given by the king of england for the surrender of the maid  and an annuity of pounds to the soldier of the duke of burgundy who had captured her  i was appointed notary in the trial  together with a certain guillaume boisguillaume  the copy of the process was shown to me is the true copy made  i acknowledge my own and my companion s signatures  and that it is the truth  two other copies were made  one was given to the inquisitor  one to the king of england  and one to the bishop of beauvais  this process was made from a certain minute written in french  by my own hand  which was given up to the judges  and was afterwards  trans lated from the french into latin by monsieur thomas de courcelles and myself  in the form in which it now stands  as well and as faithfully as possible  long after the death and execution of jeanne  as for the act of accusation and other parts of the process  maitre thomas de courcelles had very little to do with these  nor did he greatly interfere with them  with regard to the word nota  written above certain articles in the minute  there was  on the first day of the inquiry  a great tumult in the chapel of the castle at rouen  where  that day  the interrogation was held  so that jeanne was interrupted at almost every word  while she was speaking of her apparitions  certain secretaries were there two or three of the king of england  who registered  as they chose  her words and depositions  omitting all her defense and all which tended to exonerate her  i complained of this  saying it was irregular  and that i would not be responsible  as clerk  in this matter  and  therefore  on the morrow  the place of meeting was changed and convened in a certain hall of the castle  near the great hall  while two english were placed to keep order  when there were difficulties as to jeanne s answers  and some said she had not replied as i had written  i wrote nota at the top  in order that the questions might be repeated and the difficulties removed  although it is mentioned in the process that the judges stated they had received preliminary evidence  i do not remember to have seen or heard of it  but i know that  if it had been produced  it would have been inserted in the process  jeanne was brought to rouen and not to paris  because  as i think  the king of england and the principal people of his council were there  at the beginning of the process  i was sent for to attend a meeting held at a certain house near the castle  at which were present the bishop of beauvais  the abbe  of fecamp  maitre nicolas loyseleur  and many others  the bishop told me it was necessary that i should serve the king  that they meant to bring a fine case against this said jeanne  and that i was to recommend another greffier to assist me  i therefore nominated boisguillaume  i met lohier in the church  on the day after the bishop had asked him to give an opinion on the process  and inquired what he you ght of it  he replied  that the process was of no value  and could not be maintained  because it was conducted in the castle and not in a legal court  that it concerned many who were not summoned  that jeanne had no counsel  and for many other reasons  he added that  in his opinion  it was their intention to put her to death  a certain maitre nicolas de houppeville was summoned to attend the trial  and was in great danger  because he refused  maitre jean lemaitre  sub inquisitor  delayed as long as possible his attendance at the trial  and was much vexed at being compelled to attend  one day  when jeanne was being questioned  jean de chatillon spoke in her favor  saying that she was not compelled to reply to the question put to her  or to that effect  this much displeased the bishop of beauvais and his following  and there was a great tumult at his words  the bishop ordered him to be quiet  and to let the judges speak  on another occasion  when some one was advising and directing jeanne on the question of submission to the church  the bishop said  hold your tongue  in the devil s name  i do not remember the name of him who was thus spoken to  one day  some one  whose name i do not remember  having spoken of jeanne in a way which did not please the earl of stafford  the latter followed him  sword in hand  to some place of sanctuary  and  if they had not told stafford that that place was sacred  he would have slain him  those who seemed to me most affected  against jeanne  were beaupere  midi  and de touraine  one day  i went with the bishop of beauvais and the earl of warwick to the prison where jeanne was  and we found her in irons  it was said that at night she was fastened with iron chains  but i did not see her so fas,0
don t pretend i was attacking a group  i was raising a legitimate question about whether someone in canada knew enough about the topic to edit that would apply just as much in reverse  in fact  they clearly didn t know enough  but pls don t let the facts get in the way of the campaign now under way ,0
thanks for the revert hey  i just wanted to say thanks for reverting my user page after gmaxwell deleted it i know you aren t supposed to use fair use images in user namespace  but they ve only been in for a day and i plan to move the article over today or tomorrow  i think what he did was definitely overkill  and very immature  and i m glad people like you are around to clean up after people like him ,0
 hahahahaha you can t relate britons to americans  canadians  new zealanders etc  in the related ethnic groups box because your not talking about ethnic groups you are talking about countries  political boundaries  not about ethnic groups this article is about residents called britons  people born in or from britain not an ethnic group  for ethnic groups  go to english  scottish  welsh  cornish people  the ethnic group box is for ethnic groups  not countries  nationalities or citizenship ,0
don t allow yourself to be intimidated by alex  he s just a little anxious since  left oh  these faggot  s and their mood swings ,1
done  see natural logarithm  move it to complex logarithm if you find it better ,0
b  nh see b  nh for more info on vietnamese things like thati don t know this particular one  have you searched online yet  yuzu would only be known to japanese and koreans  basically ,0
 please do not add nonsense to wikipedia  it is considered vandalism  if you would like to experiment  use the sandbox  thank you a link to the edit i have reverted can be found here  link  if you believe this edit should not have been reverted  please contact me  talk  ,0
 i blieve the  trans lation from the press office is very good  for someone who is not german this may not be clear  but the first paragraph states intentions  not facts  in germany there are still people who physically hurt other people and  very few  state authorities who do not act against this  so i believe using is may be confusing  if you want to do a literal  trans lation  the upper version is closer to the original  while the press office version is closer to the meaning  diverse errors and unencelopedic context use i would like to ask this whole article to be checked through  while most of it seems all right  there are passages that make no sense  lack imporatant information or are plain wrong  examples  first paragraph of drafting process is the outbreak of the racial fanaticism in germany cost humanity approximately million people  or of the world population  about of all casualties were civilians  who died as a result of disease  starvation  genocide  in particular  the holocaust massacres  and aerial bombing  while the numbers may or may not be correct  what is the purpose of this paragraph  the people who died and especially the people who did not die because of the war but because of the holocaust are very important for the way to grundgesetz was written  but there is no connection made  the next paragraph does not make reference to this and mentions the necessity to keep history from repeating itself in a much more neutral way  later on  any war could and should be categorised as an atrocity but the war that  nazi  germany started brought a scale of atrocity never previously known and the statistics of world war ii clearly qualify it  by far  as the most heinous atrocity in all recorded history  unverified claim  clearly anti german  the figures i heard suggest that both stalin and mao had a higher death toll than  nazi  germany  correct  most of their dead were in their own country  but i do not see how that would make it any better and created thereby in germany the legal situation within which any association of persons that  by reason of their aims or the behaviour of their members or adherents  seek to undermine or abolish this constitutional order is simply illegal  and which assigns to all germans the absolute right and duty to resist any person seeking to undermine or abolish this constitutional order  because this demand makes on the entire german people the memory of the million casualties which brought the outbreak of the racial fanaticism in  hitler  s germany  while it is unclear where this text comes from  it does not seem to be a quote  i do not believe that this demand makes on the entire german people the memory of million casualties is something that should be claimed in wikipedia if it is not a direct or indirect quote of some political  moral or other authority  there is also context missing the the right and duty to resist  violence by the people is only intended as a last resort and is illegal if there is functional police or military loyal to the consitution to deal with the situation  directly below the list with senseless emphasis  there is the claim that the german consitution contains blasphemy  huh  the preamble contains a direct reference to god  other than that there is a rule that religion and state must not interfere in each others buisiness  i am not seeing any blasphemy there  at that time  germany was a fairly religious state  to sum it up  i believe there was some editor here that wanted to make modern germany look bad by applying non neutral wording and some unverified claims  the german version of this article seems much better and  logically  is checked much more often than this one  i suggest either having someone who not only read the whole grundgesetz  but also has significant political and historical knowlege check this article for further inaccuracies or using the german version  which i believe is often checked by people who know the subject  to check this one through  there should be sources to every claim and despite the atrocities in the third reich  wording should be neutral and the crimes of the  nazi s should only be mentioned in a context where it makes sense  ps  sorry for the vandalism on this discussion page  there seems to have been an error while previewing this comment  ,0
i copied the md and md content from here to the md article and removed a lot of the dc content it needs the background redone and some clean up  but it s a start ,0
clinton foundation hi  you removed an edit i made on the clinton foundation page  the edit i made was taking out a line apple service agreement that was for some reason in the middle of the clinton foundation page  pretty sure my edit was legit ,0
i m glab that you are willing to consider being more civil on the talk tage but your recent additions of so run away like a good boy  when you grow up  come back and talk are uncivil  although i appreciate that you have since promised not to repeat them  it was not my goal in the talk astromony page to be percieved as insulting you or to be percieved as an adversary  but rather to advice against the confrontational attitude which you appear to have taken from the outset and i am sorry that my comments have been interprated as something other than they were intended  it is my hope that this whole incident will just be an unfortunate minor blip at the begining of your wiki career  have a great time and stay cool while editing ,0
just to let you know  i support your contributions  as being accurate  informative  and educational i thank you for taking the time to type them i have learned quite a bit from your writings  and i wish to congratulate you on work well done eh ,0
unprotect my userpage  i need to edit it,0
thank you for experimenting with the page december on wikipedia  your test worked  and has been reverted or removed  please use the sandbox for any other tests you want to do  take a look at the welcome page if you would like to learn more about contributing to our encyclopedia a link to the edit i have reverted can be found here  link  if you believe this edit should not have been reverted  please contact me ,0
it s impossible that the population drop in year about persons  because romania s population had increased since the census  i don t believe the census  simply because there are too low figures  ex  roma population of romania was at the census  in reality is about mil open your mind  polaron  and read others sources than you provide  becuase not just yours are credible  here is the official site of the romanian tourism check all the cities population and you will see that in reality they are bigger than the census  arthur june ,0
wiem encyclopedia the article in wiem is a piece of garbage  without a single source written by unknown author  it is not a valid reference for wikipedia for any facts  and your question is ridiculous  it is your duty to prove that such order existed  i am sick repeating  during the pervious discussion i diligently lookd thru original documents and found nothing even close  i am not less than you interested to present chronology of events of these times  m  kka,0
carternut shall never be banned alf,0
 you had offered  ssb a while back you had offered to be an intermediary for squeakbox and i  as we had mutually agreed not to post to each others  talk pages  an agreement of which i am still abiding at least well  i would like to ask his assistance with a little wikipedia related project  i need the help  it may be a little fun for him  and i am totally in good faith  and need  wanting to enlist his assistance if you might communicate to him that i would like to run an idea past him  i would appreciate it  if so  i ll do it as he wishes  on his talk page or on mine  if not  that s fine too and my feelings won t be hurt thanks utc mar ,0
i only had it there for my own amusement  it made me laugh  everything i do here is for my own amusement  i do not wish to offend anyone  so i removed it ,0
more history  the following was added to the intro at telescope  i am moving it here because it seems to deal with specifically optical telescopes  i am putting it in talk because some of it does not have much to do with telescopes  camera obscura  pinhole lenses  ect and it is full of un cited claims  crystal balls were used in china and india as lenses  possibly in the form of a camera obscura  to see at a distance as early as bce  around ce  the arabian astronomer and mathematician  ibn al haytham  expanding and scientifically testing theories of euclid  ptolomey  and aristotle  wrote about both pinhole lenses and concave lenses in his mathematical book on vision  roger bacon wrote about combining lenses to see at a distance in the th century  as did the th century italian spectacle maker  giambattista della porta and a host of others ,0
thanks thanks for reverting the vandalism to my userpage even if it was slightly more inventive than the standard vandalism out there  talk to me,0
i think it s about time we update this ,0
fred m  levin hi  i noticed that you created a biographical page for a psychotherapist in the past perhaps you would care to opine on http en wikipedia org wiki wikipedia articles for deletion fred m  levin nd nomination mwalla,0
july utc probably mostly modesty some people would be mortified if their friends and co workers were to find out they had been snipped  because they confuse their fertility with their virility  maybe that particular practice had had a bad experience with a meddling relative who found out something they shouldn t ,0
 do you even understand how ironic this statement is hello  i m ronz  wikipedia is written by people who have a wide diversity of opinions  but we try hard to make sure articles have a neutral point of view  your recent edit seemed less than neutral to me  so i removed it for now  if you think i made a mistake  or if you have any questions  you can leave me a message on my talk page  thank you  ronz  talk see also wp or and wp battle  ronz  talk if this is a shared ip address  and you did not make the edit  consider creating an account for yourself so you can avoid further irrelevant notices what you just did  is called censorship  censorship  you do not like my opinion  so you censored it  i made no edits  i simply expressed opinions  i did not change anything  i brought up logical statements for discussion  who are you anyway  who gave you the power to decide what is neutral i do not understand what your purpose is  haha  who are you  the official  the authority  the almighty  i have to discus with you how my statements are necessary and then you  the official  decide  how ironic  are you aware you go against everything wikipedia is about  unregulated discussion  ,0
 leave in greenfield  ma org event incident since there are a whole list of  future  positive things listed  such as kids making pretty things  people on bikes with fancy armbands  and people planting trees  i thought it would not be out of line to list a negative event that  actually  occurred at a org demonstration it s hard on the one hand to say that this event wasn t related to org but then include all these other events that are just as related there are plenty of mentions of negative signs in the articles on tea party and demonstrations did the organizers of those events intend for those signs to be there no are they worth mentioning yes it s pretty notable that one of these events featured a threat to a person bounties on private citizens don t go up every day this article is a lot like an ad  but i guess that s the intent of the most persistent wikipedia editors  if it puts them in a positive light  it s totally relevant and notable if negative  it s not notable and totally tangential  ,0
user uxivas is back worth keepin  an eye on,0
  hello merbabu  thanks for your reply  i was going to revert too to your version  i went and read the article on the banda islands and saw the references but had to leave in a hurry  thank you for you compliment on the map i did loose some time with it  it is still a work in progress  though  i see that you are a member of wikiproject indonesia  maybe you could help with more precise locations for the portuguese presence in the area actual possessions and for how long  areas of explorations  influence and commerce trade  exact locations are not easy to came by  as for the reason for the split into two articles  it was done by an user called you can check all the relevant discussions  and participate in talk portuguese empire an exploration empire  and talk portuguese empire anachronous map of the portuguese empire please do  cheers  ,0
a page you started has been reviewed  thanks for creating greater than fire  kevinjdrieberg  wikipedia editor  just reviewed your page  and wrote this note for you greater than fire is up for deletion  do you know what to do to reply  leave a comment on i dream of horses s  talk page learn more about page curation ,0
 caucasoid  is it really necessary to mention that some uyghurs are fair skinned and have caucasoid traits  it sounds a bit like  nazi  science to me  luis rib  well  they do have such traits  you can phrase it a bit differently if you like oct utc it wouldn t be necessary if we lived in a world in which race  whether considered a real or constructed category  was irrelevant  unfortunately  that s not the case  the ethnic characteristics of uyghurs play an important role in discussions of the relationship between uyghurs and han chinese and thus how chinese xinjiang is or should be  in order to understand the politics of uyghur chinese relations  it s important to know that these characteristics are commonly discussed february utc why caucasoid traits  these traits are probably more semitic than caucasoid the more we try to parse this issue the thornier it gets  read the caucasian race entry in wikipedia and see if you can find any way to separate semitic from caucasoid  the entire concept of race is in dispute  and regardless of how people ordinarily discuss differences  an encyclopedia ought to try to avoid such uninformed hypotheses in its entries  it might be better to describe  for example  a people as having blue eyes and fair skin and lacking the epicanthic fold  as well as being largely muslim  than to try to categorize them by race  and so i d agree that dropping caucasoid would be smart  after all  much of the european population has at least some mongolian ancestry  as do iranians  turks  central asians  and so on and uyghurs are certainly included in this distribution regardless of their caucasoid traits  and if you go back far enough  i suppose the entire world population has african ancestry  you can see how this can become like an argument about how many angels can dance on the head of a pin  and has no place in an encyclopedia that is trying to be authoritative and factual  ,0
 how is the article promoting or advertising jones  theories  is it not merely stating his own observations  and also information known to be factual ,0
he did to weekly jump,0
taxonomic error mr  shyamal  who is written in the articles of rognes is an enormous stupidity because in the monograph of senior white  aubertin smart diptera  vol  vi  family calliphoridae fauna of british india it is mentioned bengalia r d myodaiores  p genotype  b  labiata r d this fact is confirmed per much author  among the large specialists of the world kurahashi  benjaphong omar yu  verves burmanos,0
so  you re saying place signs were using c for place names with the sound or were you saying you only saw the signs with the letter c  without hearing how names are pronounced  you only said you saw c earlier ,0
