comment,toxic
perhaps the question is more of philosophy than of mathematics  and we don t have any regulars at wikiproject math who are philosophers of mathematics t c ,0
except for the fact that there s no information for the table  no confirmation on number of episodes  why don t you just put in so it s just clutter and not vandalism ,0
right  on may which is not the stars and bars ,0
perhaps goodday you could provide a diff for this thought as i am unaware of it  btw i hope the move is going went ok ,0
 it is also unfair that i can t respond to the allegations  talk ,0
i never fuck  ing made this mother fuck  ing article i just fuck  ing edited it and that was a fuck  ing long time ago fuck  ing  ass hole s  pissing me off  ,1
has anyone ever considered including tag team edit warring as a  rr violation  when two people act in tandem  unintentionally or intentionally  to make the same revert four times  they may not technically violate the  rr rule  but they certainly do so in spirit this was the problem on both sides in the edit war on the canada page  and precisely what i wanted to avoid on the dominion page  would it not be easier to warn editors as you did here rather than shut down pages for weeks at a time as was done in the canada case  i m sure this would cure the escalation problem without blocking access to pages  any comments on this ,0
  fuck  ed with the wrong muchacho july utc ,1
thanks but an unblock would be a compromise i live on the margins here  creating articles on various subjects  then see them deleted  it s a form of performance art many of them don t get deleted medieval philosophy is still there and history of logic  to name a few i m one of those people they just don t know what to do with  and i like it like that ,0
  yes  i do hope to get it to ga status in the future  wp mostv states that for fictional characters  their storylines should come first  and then the information on their creation and characterization  it makes more sense to read about what storylines the character has been involved in  before going into the production of it all  the same style is used for articles on books  films and television shows episodes ,0
hi im a fuck  ing bitch ,1
please educate me as to how this article is a copyright infringement and  if so  from which source  once this has been established could you explain how best to rectify the situation  thank you,0
men s ranking figure  while nice to look at  misses key time between olympics and world championships that s all there is to it in the title  iihf lists a post olympics ranking  and ranking  presumably post wc to exclude this period is incorrect  as it is a time where canada was ranked  st overall  russia  nd  the same issue will happen this year as rankings will change twice  after olympics and again after wc ,0
there are many broken nostrils in this pancreas,0
that last line  the new version is better  is ypov this  new  your  version just complicates the issue and makes the article less simple to read tell me  why must boston be mentioned as a cultural and business hub at all this seems to be at the heart of your bias it appears as you want the viewers to get from reading it that boston is somehow the nerve center and city that new england revolves around and looks up to why must this illusion be on the page ,0
 utc  it sounds wrong because first it reads are which is present tense ee and then it reads used which is the past tense  i reworded the whole thing to past tense because we are discussing already published works as opposed to works being published or yet to be published  arnfj  r bjarmason sep ,0
and you took your time to answer ,0
 yobot  incorrect defaultsort hi  yobot  an incorrect defaultsort  it s puzzling as to why it didn t recognize the article as being about a person  among other clues  it included birth and death dates at the top  as well as a which yobot substituted to additionally include the correct defaultsort xa  ab  am  ,0
biased  unreliable emotionally written by armenin wiki editors pls  stop using the wikipedia for your dirty propaganda and lobbying purposes  there was no genocide  this is a amyth advanced by the armenian church and armenian fundamentalist fascists  a nation can not be subject to a egnocide when it has several heros for whom you can see statues in yerevan  irevan jew s don t have it  the resolution is the act of some sold congressmen who want to appease the armenian lobby  it has no reliable  valid and neutral content  it is kjust a piece of dirty and lie facts presented and written by christian missionaries working to kill turks and kurds in s  you can claim to be subject to genocide as much as you want  but this thing did never happen  some armenian fundamentalists and fascists  who were killing kurds  turks and azerbaijanis  were killed by great sons of the turkic nation and i am proud of them  go and propogate your lie as much as you can  you will achieve nothing  raman ,0
add mobile porn as additional wp also link,1
smer sd why is the slovak party smer sd between non inscrits  they are regular socialists  they used to be out of pes  but that was settled pretty long ago  liberal nationalist,0
 utc has anyone considered how matter  the stuff we are all made from  actually interact with time and time travel  if i were to travel back in time  would i be  frozen  and isolated in spacetime  whilst everything else around me travel backwards in time  or will i also physically and biologically travel back in time  that is i get younger and younger  and then disappear because i was not yet created  thus defeating the grandfather paradox  although if it were possible for signals  or information  to travel backwards and forwards in time  does this possibility automatically extend to matter as we know it  ie particles giving rise to electrons  protons and neutrons  and ultimately biological beings such as ourselves july,0
  i want to offer you a tremendous thank you for your suggestions  which i believe will be paramount to the successful inclusion of rantmedia i ve vastly improved the article since the afd nomination as well as  since yesterday afternoon i wasn t clear to me what was necessary to be done with the article  and you were truly the first to really answer my question of what is it going to take so from the bottom of my heart  thank you  t  c ,0
 i have to laugh when watching the supposedly british national news  with guys barely up to their ankles in snow implying that ragnarok is upon us  yet on the same day  when trees are being blown down and main roads being  block  by snow in scotland  it doesn t seem to be noteworthy  scotland routinely gets ignored on the national news  and even people from the north of england were complaining about the fuss made by the southern oriented news  tourists appear to be amazed that things are falling apart because of something like this  my mother had a very good giggle at the reporters live in trafalgar square in a couple of inches of snow  or beside a main road  barely ankle deep lance tyrell ,0
a friendly advice  if you have to refer to me  kindly use cult free and not only cult ,0
 great links  imo the american people are on the whole good and decent  but the so called leaders are fully controlled by an elite bent on domination and control  this whistelblower says the same talk  ,0
queen s university as stated previously  i am quite pertrubed and to be quite honest  frustrated that you would remove the section pertaining to the university s traditions  do you have a personal vendetta against the institution or dislike it  for w hate ver reason you removed the compliation of material regarding the jackets and other traditions  which i find odd considering similar traditions have been allowed to remain on other university wikipedia pages  mindlessly deleting material without group consent constitutes vandalism and  while i am sure that your intention was not malicious  it was a short sighted move on your part  please allow us to discuss this in greater detail ,0
 january utc  the argument at wp natural seems to rely on showing that the other name is common  so you need to prove that the other name is common  numbers might help a bit  also  above we are told that gohatto rather than is the name of the film in japan  but this turned out to be false  incidentally  ryuhei matsuda  it seems to me  looks more like his mother than his father  what do you think  also  how authentic is the portrayal of the shinsengumi in this film  do you have any historical insights ,0
 unspecified source for image metropolitan of moscow makariy nevskiy jpg  thanks for uploading image metropolitan of moscow makariy nevskiy jpg  i noticed that the file s description page currently doesn t specify who created the content  so the copyright status is unclear  if you did not create this file yourself  then you will need to specify the owner of the copyright  if you obtained it from a website  then a link to the website from which it was taken  together with a restatement of that website s terms of use of its content  is usually sufficient information  however  if the copyright holder is different from the website s publisher  then their copyright should also be acknowledged as well as adding the source  please add a proper copyright licensing tag if the file doesn t have one already  if you created took the picture  audio  or video then the  tag can be used to release it under the gfdl  if you believe the media meets the criteria at wikipedia fair use  use a tag such as  or one of the other tags listed at wikipedia image copyright tags fair use  see wikipedia image copyright tags for the full list of copyright tags that you can use if you have uploaded other files  consider checking that you have specified their source and tagged them  too  you can find a list of files you have uploaded by following this link unsourced and untagged images may be deleted one week after they have been tagged  as described on criteria for speedy deletion  if the image is copyrighted under a non free license  per wikipedia fair use  then the image will be deleted hours after if you have any questions please ask them at the media copyright questions page  thank you  do you want to opt out of receiving this notice hi ,0
 percent koreans eat dog meat koreans have tried not regular korean food diet  don t genearalize or finger point that all koreans eat dogmeat  that isn t true ,0
support lets protect and save this page from user balagonj this page has full of errors and invalid references ,0
apparently i thought tom was offline and filed an edit warring report  and yellowmonkey picked it up before tom mentioned the page protection we ll see if it sticks ,0
newsletter draft ready hi dank i have prepared an initial draft of our drive wrap up newsletter at wikipedia wikiproject guild of copy editors newsletters april if you could find the time to check it over before it goes out  that would be super  thanks ,0
should be omitted entirely ,0
is that not a true description on a booger  if not then prove to me what is ,0
stay off my talk page  stalker ,0
anthony de mello hi i need this page written  anthony de mello  it currently redirects to a priest  do you have any suggestions on the dab title  cricketer  ,0
  thanks  and happy new year to you too  let s talk about it ,0
more mature way  central posted  ,0
stop vandalizing my userpage  i know it s someone from here ,0
oppose  i do not think a merge is a good idea ,0
maybe  but that does not lead to the conclusion that the taip aircraft remained in africa and did not return back after ferrying the soldiers  the article on colaco net also does not shed any light on this ,0
thanks thanks for the thanks  i just leave them in my watchlist after i found an archive full of vandalism a while back  given that it was slashdotted  i suspect we will see a bit more of it  i might get someone else to fully protect it if it continues  i can t do it because of coi i would also like to thank you for keeping an open mind  changing  votes is an encouraging sign of good faith  regards ,0
hello  if you re interested  we could really use your help  ,0
  fuck all rides at worlds of fun i  hate  all rides at worlds of fun because they are sh tty and boring  all ride operators at wof should be fired sued and hanged  burn all wof coasters  arrest all wof park operators  assassinate all wof customers  i heard that a boy died on timberwolf on august that s stupid  worlds of fun should have nown better to built that sh t ride  worlds of fun cares about money and prophet moar than they re customers  burn that sh t park down fuck you rides  worlds of fun is dangerouser than grround zero and area worlds of fun should burn in hell ,1
as to job for you sure thing as soon as i find time for that  also  i notifyed novanova asking him to start editing the http en wikipedia org wiki croatisation  this guy knows a lot about croats and their history ,0
oh ok  i just wanted to see what people thought  anyway its up for csd  hey do you like my talk page  i hope you don t mind talk er,0
wrong  the capital is podgorica as it has always been since july the seat of government  parliament  and president is in podgorica  cetinje is only the seat of the kingdom of montenegro in exile  and besides  only capital cities have embassies  and podgorica has them and do you see any in cetinje  no  besides  no one in montenegro nor in the world say that cetinje is the capital of montenenegro  but instead  they say it is podgorica  and also  that consitution was adopted in very outdated  and a new one is due next year ,0
mark ii subsec i removed the mark iix subsections and made them bulleted lists there was no reason  in my eyes  to subsec one line of information  ,0
 can there be a more concise listing the listing of other inventions is profoundly vague  why group different categories together  why even mention things that the chinese received purely from outside sources  there should be a much more complete  well managed list of chinese developments  which i ve yet to find  along with how these were  trans mitted globally  and whether or not places like europe got them purely from the chinese this really needs the attention of people with some remote expertise  which i guess is somewhat there when needham s work  which is profoundly rare in private collections was cited  not like the arrogant bigoted ass who was crying about chinese nationalism  yet then went onto say that they only invented noodles and besides  why are things like the cannon and porcelain listed under other inventions who developed these independently  ,0
in history there could be a consensus view or a mainstream view  in theology there is no mainstream or consensus view  since most of theology depends upon the church membership of the theologian  historical scholarship aims at universality and objectivity  while theology makes no such claims  it is true that there are millions who believe that jedp was birthed in hell  or would believe it if they knew what jedp means so in principle their view is notable  but as enns said  it is a fringe view in the academe  even among scholars who actually disagree with jedp  the sources used to build wikipedia are academic sources  therefore jedp and its st century offspring are given by default the weight they have inside the academia  while the view of the fundamentalists is treated according to wp undue  this does not mean that wikipedia could say that the fundamentalists are theologically wrong  wikipedia has no theology of its own but it is entitled to say that inside historical scholarship they are a fringe view  of course  this does not exclude serious scholarship done at religious faculties  since as ehrman said in one of his bestsellers  us mainline protestant and catholic theological seminaries and divinity schools do teach mandatory historical criticism classes  so  in a sense  scholars from such faculties are thoroughly acquainted with historical criticism and built their careers upon its assumptions  only fundamentalist seminaries and divinity schools choose to default against historical criticism  they are free to do this  but this cuts against their claims of being mainstream historians ,0
well  i m sorry  but attacking me and my edits is exactly what you re doing wow  there s some seriously snotty people on wikipedia  and yes  there is a need to separate the featured single definitly ,0
 tfd nomination of template silentredirect template silentredirect has been nominated for deletion  you are invited to comment on the discussion at wikipedia templates for deletion template silentredirect  thank you  talk watermarks i shall remove the obvious ones  the less obvious ones stay  i am allowed to watermark images with anything whatsoever i wish to  even if it s a contradiction  and if you wish me to use up further wp  bandwidth by re uploading them  that has no effect on me  i can t do anything until this evening  and if any get deleted  i shall reupload them  yours without respect  talk email you could have the grace to reply  i said that i d deal with them this evening  but only the ones where the watermark is visible from the page  so off  talk email i am planning to re upload them with less obtrusive watermarks  such as that on image bliss parody jpg talk email it wasn t vandalism  i used an external link as per your instructions  which incidentally i m not bound to follow  i am certainly on the verge of requesting mediation  as you are disrupting my life  never mind wp  to make a point  i will tell you one more time  any images are better than none  if you wish to get your own pix of all the concerned images  you re damn welcome to try  but they are gfdl therefore there s no grounds for removal talk email ps i shall add the external link again  not as an image  and if you remove it i shall make a formal complaint to the wikimedia foundation  and the information commissioner in london talk email your conduct is a little off in this matter  while i m all for discussing the issues with users  let s keep it civil please  thanks  talk i disagree  rob it is far more than a little off  images watermarked as such are not in any way appropriate for wikipedia  this is an encyclop  dia  not a pet image project  if thedoctor isn t happy to play ball  he can go elsewhere  talk i am proposing a change to the image use policy to forbid watermarked images  please voice an opinion at wikipedia talk image use policy user created images  thanks talk i edit from the united kingdom  and under the computer misuse act  the editing of information online is illegal  without permission  the button at the top of every page that says edit this page among other things  constitutes that permission  while the policies and guidelines form conditions  since there is no condition against my image  it has a legal right to be there  q e d talk email true  but therefore your addition fails under the same logic  also  wikimedia own the servers  it s their right to delete it id apologies to ed for invading his talk page  but what a load of rubbish  wikipedia are under no legal obligation whatsoever to host your images  regardless of whether they meet any policy  i have no idea under what flawed logic you presume that the fact you can edit wikipedia means that your edits must legally be accepted  if the computer misuse act states that the editing of information online is illegal without permission  that implies that editing with permission is legal  and nothing more  furthermore  by your logic  i have the legal right to edit wikipedia  and remove your images  i fail to see what on earth you intend to tell your lawyer  but i don t imagine the wikimedia board are too concerned  talk ignoring the gibberish i,0
 artpop album hello  thank you for all your contributions  i make this message in good faith  please do not make hidden comments like this stating that an editor will be  block  if they remove a redirect  i am in no position to be asking this but i am saying this as it could turnaway new contributors  who aren t aware of the rules  feeling they have been bitten  in this case  i think a kind  user  talk page message would be more appropriate and effective  also  you edit was reverted so i reverted it back to your version but also removed the block warning as it is not appropriate  no admin will should block just because a user removed a redirect  specially if that hidden message was their only warning feel free to correct me if wrong again  i write this in good faith  cheers huntley  ,0
crown prince wouldn t it have been prince elect  denmark was a elective monarchy during this time ,0
hamish macdonald  disambiguation  hello  just to let you know that as this now only has two entries one of this name and one with a very similar name  i have tagged it for deletion using template db disambig  if you have any questions about this  please let me know  best wishes ,0
 my cents  as someone close to the korean american community  it s pretty standard practice to give both an american and a korean name at first  i don t know for sure that that s the case here  but wouldn t be surprised  it s probably explained in her book  ,0
 died in or not i think it s better to settle the matter here instead of going back and forth  so  the ip user claims that the whole thing is a hoax  that she died in europe years ago and that there s no hawaii obit  first of all  is the forevermissed a user submitted website do you know her family personally or do you know somebody who knows the family  we d like to get a more elaborate explainantion behind the claim that she s been dead years ago  i see that her supposed obituary is pretty detailed  are the rest of the biographical information accurate  though  and the picture ,0
  august utc dear  the hour block that you placed on my account yesterday for personal attacks has just expired  and while i must say that i was not happy about the block  i harbor no hard feelings towards you  if you check my previous contributions  you can see that i have been a productive editor on wikipedia  i d just like to let you know that while i was guilty of personal attacks against  and i was goaded into doing so by these two individuals  in order to avoid future blocks  i promise not to engage in anymore personal attacks  and if i am goaded by trolls such as these two individuals  i will simply ignore them  was repeatedly reverting a comment which i made concerning statements made in the hugo chavez article which i found to be biased  my issue with  concerns his nastiness and uncivility  he is far too possessive of articles which he has created  and he becomes very angry when edits are made to such articles  after multiple revisions of legitimate edits which i made to his articles  i told him to leave me alone  he proceeded to foul my discussion page with unwanted and unsolicited comments  when i objected to this  he goaded me into calling him a profanity while i respect your role as a wikipedia administrator  i d like to respectfully request that in the future  you exercise better discretion when blocking a user based on one sided information  thank you for your understanding ,0
links in results  a mess  links anywhere except the actual book ,0
it wasn t me that added the glebe park link  though i might ve wikified it  i ve never actually been there  so i m afraid i won t be of much help at the moment though i ve been meaning to go look for a while ,0
go away  why did you revert my edit on blowdart s user talk page  surely thats his privelege  users like you give wikipedia a bad name  stop being such a busybody ,0
the head ways pounds and feels like play dow dont tuch them they will fall off,0
sarek of vulcan  unfortunately for you  you cannot ban a fact  sarek of vulcan  unfortunately for you  you cannot ban a fact fact  lawrencenkhoo told me here on wikipedia that companies keep their retained profits in the bank  fact  that is absolutely untrue fact  sarek of vulcan bans me for stating that  fact  sarek of vulcan can ban me but cannot ban facts ,0
keep your chin up  darwinism was not accepted over night  there appears to be more sense in  the  aat origins  than the sort cut hypothesis that our  ancestors went from swinging in trees to the prairies  and then  eons later  take up a sedentary life style so they could edit wikipedia and face book etc all day one only has to watch little kids on the beach the first time a wave throws them bottom over elbow they may well cry but after a time they can t wait to get into the water again  it is as if  being at home on a sea edge environment is hard wired into their genes unfortunately  the rise in sea level since these times means that evidence of these coastal communities may never be found keep plugging away until the old hypothesis fade away ,0
  nazi  filth is impolite jan utc ,1
interesting  i checked the other case number kunzang lhamo cited  which can t be used for wiki since it s original research  but going a step further  i can t find that case number on san bernadino s open access  either in civil or criminal records ,0
i also would like to thank you for that as well  i have found an official document on this matter on the legislative web site speaking to the name of the parliament buildings  perhaps we should include information about this in the main document ,0
is this drug really that expensive you can get it over the counter for about ten dollars ,0
there isn t a reason  someone claimed some false authority by adding a hidden note into the article  this is not acceptable ,0
 fixed  thanks talk contribs  ,0
